[
  {
    "id": 1,
    "title": "Classic Scenario 1: Ordinary Start",
    "description": "Start life as an average child in an average place.",
    "startingCharacter": {
      "firstName": "Drew",
      "lastName": "Bailey",
      "gender": "OTHER",
      "age": 0,
      "health": 80,
      "happiness": 80,
      "smarts": 70,
      "looks": 60,
      "money": 0,
      "reputation": 0,
      "isAlive": true,
      "relationships": [],
      "achievements": []
    },
    "events": [
      {
        "id": 1001,
        "title": "Event 1001: Surprise",
        "description": "This is a major event in your life. Scenario #1001 unfolds.",
        "choices": [
          {
            "text": "Go for it!",
            "result": {
              "statChanges": {
                "health": 1,
                "happiness": 8,
                "smarts": -1,
                "looks": -2,
                "money": 336,
                "reputation": -3
              },
              "nextEventId": 1002,
              "unlockAchievementId": null
            }
          },
          {
            "text": "Play it safe.",
            "result": {
              "statChanges": {
                "health": 1,
                "happiness": 1,
                "smarts": 0,
                "looks": 0,
                "money": -254,
                "reputation": 1
              },
              "nextEventId": 1003,
              "unlockAchievementId": null
            }
          }
        ]
      }
    ]
  },
  {
    "id": 2,
    "title": "Classic Scenario 2: City Life",
    "description": "Start life as an average child in an average place.",
    "startingCharacter": {
      "firstName": "Jordan",
      "lastName": "Morgan",
      "gender": "OTHER",
      "age": 0,
      "health": 80,
      "happiness": 80,
      "smarts": 70,
      "looks": 60,
      "money": 0,
      "reputation": 0,
      "isAlive": true,
      "relationships": [],
      "achievements": []
    },
    "events": [
      {
        "id": 1002,
        "title": "Event 1002: Crisis",
        "description": "This is a major event in your life. Scenario #1002 unfolds.",
        "choices": [
          {
            "text": "Go for it!",
            "result": {
              "statChanges": {
                "health": -4,
                "happiness": -5,
                "smarts": -1,
                "looks": -1,
                "money": 218,
                "reputation": 1
              },
              "nextEventId": 1003,
              "unlockAchievementId": null
            }
          },
          {
            "text": "Play it safe.",
            "result": {
              "statChanges": {
                "health": 0,
                "happiness": 0,
                "smarts": 0,
                "looks": 0,
                "money": -195,
                "reputation": -1
              },
              "nextEventId": 1004,
              "unlockAchievementId": null
            }
          }
        ]
      }
    ]
  },
  {
    "id": 3,
    "title": "Classic Scenario 3: City Life",
    "description": "Start life as an average child in an average place.",
    "startingCharacter": {
      "firstName": "Casey",
      "lastName": "Taylor",
      "gender": "OTHER",
      "age": 0,
      "health": 80,
      "happiness": 80,
      "smarts": 70,
      "looks": 60,
      "money": 0,
      "reputation": 0,
      "isAlive": true,
      "relationships": [],
      "achievements": []
    },
    "events": [
      {
        "id": 1003,
        "title": "Event 1003: Big Decision",
        "description": "This is a major event in your life. Scenario #1003 unfolds.",
        "choices": [
          {
            "text": "Go for it!",
            "result": {
              "statChanges": {
                "health": 3,
                "happiness": 0,
                "smarts": -1,
                "looks": 0,
                "money": 1513,
                "reputation": 0
              },
              "nextEventId": 1004,
              "unlockAchievementId": null
            }
          },
          {
            "text": "Play it safe.",
            "result": {
              "statChanges": {
                "health": 0,
                "happiness": 2,
                "smarts": 0,
                "looks": 0,
                "money": 674,
                "reputation": 0
              },
              "nextEventId": 1005,
              "unlockAchievementId": null
            }
          }
        ]
      }
    ]
  },
  {
    "id": 4,
    "title": "Classic Scenario 4: Ordinary Start",
    "description": "Start life as an average child in an average place.",
    "startingCharacter": {
      "firstName": "Peyton",
      "lastName": "Morgan",
      "gender": "OTHER",
      "age": 0,
      "health": 80,
      "happiness": 80,
      "smarts": 70,
      "looks": 60,
      "money": 0,
      "reputation": 0,
      "isAlive": true,
      "relationships": [],
      "achievements": []
    },
    "events": [
      {
        "id": 1004,
        "title": "Event 1004: Crisis",
        "description": "This is a major event in your life. Scenario #1004 unfolds.",
        "choices": [
          {
            "text": "Go for it!",
            "result": {
              "statChanges": {
                "health": -2,
                "happiness": 0,
                "smarts": 1,
                "looks": 2,
                "money": -730,
                "reputation": -3
              },
              "nextEventId": 1005,
              "unlockAchievementId": null
            }
          },
          {
            "text": "Play it safe.",
            "result": {
              "statChanges": {
                "health": -1,
                "happiness": 2,
                "smarts": 0,
                "looks": 0,
                "money": -72,
                "reputation": -1
              },
              "nextEventId": 1006,
              "unlockAchievementId": null
            }
          }
        ]
      }
    ]
  },
  {
    "id": 5,
    "title": "Classic Scenario 5: Humble Beginnings",
    "description": "Start life as an average child in an average place.",
    "startingCharacter": {
      "firstName": "Alex",
      "lastName": "Taylor",
      "gender": "OTHER",
      "age": 0,
      "health": 80,
      "happiness": 80,
      "smarts": 70,
      "looks": 60,
      "money": 0,
      "reputation": 0,
      "isAlive": true,
      "relationships": [],
      "achievements": []
    },
    "events": [
      {
        "id": 1005,
        "title": "Event 1005: Crisis",
        "description": "This is a major event in your life. Scenario #1005 unfolds.",
        "choices": [
          {
            "text": "Go for it!",
            "result": {
              "statChanges": {
                "health": 0,
                "happiness": 7,
                "smarts": 4,
                "looks": -1,
                "money": -917,
                "reputation": 4
              },
              "nextEventId": 1006,
              "unlockAchievementId": null
            }
          },
          {
            "text": "Play it safe.",
            "result": {
              "statChanges": {
                "health": 1,
                "happiness": 2,
                "smarts": 0,
                "looks": 0,
                "money": 6,
                "reputation": -1
              },
              "nextEventId": 1007,
              "unlockAchievementId": null
            }
          }
        ]
      }
    ]
  },
  {
    "id": 6,
    "title": "Classic Scenario 6: City Life",
    "description": "Start life as an average child in an average place.",
    "startingCharacter": {
      "firstName": "Drew",
      "lastName": "Peyton",
      "gender": "MALE",
      "age": 0,
      "health": 80,
      "happiness": 80,
      "smarts": 70,
      "looks": 60,
      "money": 0,
      "reputation": 0,
      "isAlive": true,
      "relationships": [],
      "achievements": []
    },
    "events": [
      {
        "id": 1006,
        "title": "Event 1006: Surprise",
        "description": "This is a major event in your life. Scenario #1006 unfolds.",
        "choices": [
          {
            "text": "Go for it!",
            "result": {
              "statChanges": {
                "health": 1,
                "happiness": -2,
                "smarts": 0,
                "looks": 2,
                "money": 1923,
                "reputation": -3
              },
              "nextEventId": 1007,
              "unlockAchievementId": null
            }
          },
          {
            "text": "Play it safe.",
            "result": {
              "statChanges": {
                "health": 1,
                "happiness": 0,
                "smarts": 0,
                "looks": 0,
                "money": 845,
                "reputation": 0
              },
              "nextEventId": 1008,
              "unlockAchievementId": null
            }
          }
        ]
      }
    ]
  },
  {
    "id": 7,
    "title": "Classic Scenario 7: City Life",
    "description": "Start life as an average child in an average place.",
    "startingCharacter": {
      "firstName": "Casey",
      "lastName": "Peyton",
      "gender": "FEMALE",
      "age": 0,
      "health": 80,
      "happiness": 80,
      "smarts": 70,
      "looks": 60,
      "money": 0,
      "reputation": 0,
      "isAlive": true,
      "relationships": [],
      "achievements": []
    },
    "events": [
      {
        "id": 1007,
        "title": "Event 1007: Life Change",
        "description": "This is a major event in your life. Scenario #1007 unfolds.",
        "choices": [
          {
            "text": "Go for it!",
            "result": {
              "statChanges": {
                "health": 1,
                "happiness": 3,
                "smarts": -1,
                "looks": 2,
                "money": 1953,
                "reputation": 4
              },
              "nextEventId": 1008,